{
  "drill_ids": [
    "C028-D01-GENESIS-CLEAN",
    "C028-D02-JAVA-DIR-REJECT",
    "C028-D03-SNAPSHOT-AUTHENTIC",
    "C028-D04-SNAPSHOT-MISSING-SIGNATURE",
    "C028-D05-SNAPSHOT-MALFORMED",
    "C028-D06-SNAPSHOT-UNKNOWN-KEY",
    "C028-D07-SNAPSHOT-REVOKED-KEY",
    "C028-D08-SNAPSHOT-ROTATION",
    "C028-D09-SNAPSHOT-STALE-VALID",
    "C028-D10-SNAPSHOT-CLOCK",
    "C028-D11-SNAPSHOT-ROLLBACK-HEIGHT",
    "C028-D12-SNAPSHOT-CHECKPOINT",
    "C028-D13-SNAPSHOT-COMPROMISED-METADATA",
    "C028-D14-SNAPSHOT-WRONG-IDENTITY",
    "C028-D15-SNAPSHOT-NEWER-FORMAT",
    "C028-D16-SNAPSHOT-PARTIAL-CORRUPT",
    "C028-D17-SNAPSHOT-DURABLE-FAULTS",
    "C028-D18-MIGRATION-DURABLE-FAULTS",
    "C028-D19-MIGRATION-WRONG-IDENTITY",
    "C028-D20-UPGRADE-ROLLBACK-MATRIX",
    "C028-D21-CORRUPTION",
    "C028-D22-RESYNC-FALLBACK",
    "C028-D23-OFFLINE-SNAPSHOT",
    "C028-R01-AUTHENTIC-BUNDLE",
    "C028-R02-MISSING-MANIFEST",
    "C028-R03-MALFORMED-SIGNATURE",
    "C028-R04-MISMATCHED-MANIFEST",
    "C028-R05-UNKNOWN-KEY",
    "C028-R06-EXPIRED-POLICY",
    "C028-R07-REVOKED-KEY",
    "C028-R08-THRESHOLD",
    "C028-R09-MISSING-EXTRA-ARTIFACT",
    "C028-R10-SUBSTITUTED-MIRROR-BYTES",
    "C028-R11-DETACHED-SBOM",
    "C028-R12-DETACHED-PROVENANCE",
    "C028-R13-MIXED-RELEASE",
    "C028-R14-PLATFORM",
    "C028-R15-SAPLING-EXCLUSION",
    "C028-R16-TRUST-ROTATION",
    "C028-R17-OFFLINE-RELEASE",
    "C028-R18-PREINSTALL-NO-MUTATION",
    "C028-R19-CLEAN-ENDPOINTS-FULL",
    "C028-R20-CLEAN-ENDPOINTS-SOLIDITY",
    "C028-R21-CONTAINER-SERVICE"
  ],
  "fault_phases": [
    "Preflight",
    "JournalSynced",
    "StagingCreated",
    "DataWritten",
    "DataSynced",
    "GenerationPublished",
    "ManifestSwitched",
    "DirectorySynced",
    "CleanupSynced"
  ],
  "final_root_contract": "snapshot import must equal the signed state root and clean resync must equal the selected network root",
  "negative_drill_ids": [
    "C028-D02-JAVA-DIR-REJECT",
    "C028-D04-SNAPSHOT-MISSING-SIGNATURE",
    "C028-D05-SNAPSHOT-MALFORMED",
    "C028-D06-SNAPSHOT-UNKNOWN-KEY",
    "C028-D07-SNAPSHOT-REVOKED-KEY",
    "C028-D08-SNAPSHOT-ROTATION",
    "C028-D09-SNAPSHOT-STALE-VALID",
    "C028-D10-SNAPSHOT-CLOCK",
    "C028-D11-SNAPSHOT-ROLLBACK-HEIGHT",
    "C028-D12-SNAPSHOT-CHECKPOINT",
    "C028-D13-SNAPSHOT-COMPROMISED-METADATA",
    "C028-D14-SNAPSHOT-WRONG-IDENTITY",
    "C028-D15-SNAPSHOT-NEWER-FORMAT",
    "C028-D16-SNAPSHOT-PARTIAL-CORRUPT",
    "C028-D17-SNAPSHOT-DURABLE-FAULTS",
    "C028-D19-MIGRATION-WRONG-IDENTITY",
    "C028-D20-UPGRADE-ROLLBACK-MATRIX",
    "C028-D21-CORRUPTION",
    "C028-R02-MISSING-MANIFEST",
    "C028-R03-MALFORMED-SIGNATURE",
    "C028-R04-MISMATCHED-MANIFEST",
    "C028-R05-UNKNOWN-KEY",
    "C028-R06-EXPIRED-POLICY",
    "C028-R07-REVOKED-KEY",
    "C028-R08-THRESHOLD",
    "C028-R09-MISSING-EXTRA-ARTIFACT",
    "C028-R10-SUBSTITUTED-MIRROR-BYTES",
    "C028-R11-DETACHED-SBOM",
    "C028-R12-DETACHED-PROVENANCE",
    "C028-R13-MIXED-RELEASE",
    "C028-R14-PLATFORM",
    "C028-R15-SAPLING-EXCLUSION",
    "C028-R16-TRUST-ROTATION",
    "C028-R17-OFFLINE-RELEASE",
    "C028-R18-PREINSTALL-NO-MUTATION"
  ],
  "platform_id": "P-LINUX-X64",
  "resync_fallback": "empty Rust-owned destination with authenticated network/genesis origin",
  "rollback_target": "retained previous authenticated release slot",
  "schema": "c028-recovery-matrix-v1"
}
